{
  "as_of_date": "2026-05-12",
  "data_shapes": [
    "relational_core",
    "full_text_docs",
    "semi_structured_jsonb",
    "embeddings_vectors"
  ],
  "existing_postgres_topology": "single_primary",
  "explicit_bias_against": [],
  "explicit_bias_for": [
    {
      "extension_slug": "pgvector",
      "reason": "Hybrid retrieval uses tenant-filtered embeddings."
    },
    {
      "extension_slug": "pg_trgm",
      "reason": "Support queries include typos and product-code fragments."
    }
  ],
  "free_form_notes": "The assistant retrieves support articles and ticket fragments with lexical search, fuzzy matching, embeddings, tenant filters, and deletion workflows. Embeddings have model versions and offline relevance tests, so vector search is no longer speculative.",
  "intake_id": "knowledge-support-ai-assistant-backend",
  "migration_or_federation_needs": {
    "has_legacy_non_postgres_source": false,
    "has_legacy_postgres_source": false,
    "requires_federation_via_fdw": false,
    "requires_zero_downtime_migration": false
  },
  "organization": {
    "industry": "knowledge_ai",
    "managed_service_requirement": "strongly_preferred",
    "operational_tolerance": "medium",
    "portability_constraints": [
      "aws_rds"
    ],
    "team_size_engineers": 16
  },
  "scale_signals": {
    "concurrent_connections_peak": 340,
    "growth_rate_month_over_month": 0.1,
    "read_throughput_qps": 1900,
    "row_counts_largest_tables": {
      "article_chunks": 6200000,
      "tenant_memberships": 1400000,
      "ticket_chunks": 18000000
    },
    "write_throughput_rows_per_sec": 180
  },
  "security_constraints": [
    "rls_required",
    "pii_in_scope"
  ],
  "tenancy_model": "multi_tenant_shared_schema",
  "workload_patterns": [
    "search_heavy",
    "read_heavy",
    "semantic_retrieval",
    "strong_tenant_locality"
  ]
}
